{
  "id": "agency",
  "name": "Agency Site",
  "category": "marketing",
  "description": "Portfolio showcase, services, team members, and contact page.",
  "kits": ["content"],
  "layout": {
    "type": "landing",
    "header": { "show": true, "search": false, "notifications": false, "userMenu": false }
  },
  "routes": [
    { "path": "/", "page": "home", "label": "Home" },
    { "path": "/work", "page": "work", "label": "Our Work" },
    { "path": "/services", "page": "services", "label": "Services" },
    { "path": "/contact", "page": "contact", "label": "Contact" }
  ],
  "pages": {
    "home": {
      "title": "Home",
      "sections": [
        { "type": "hero", "props": { "title": "We build digital experiences", "subtitle": "A creative agency specializing in web design, development, and brand strategy.", "cta": "View Our Work", "ctaHref": "/work" } },
        { "type": "features", "props": { "title": "What We Do", "columns": 3 } },
        { "type": "PostList", "props": { "title": "Featured Work", "limit": 3 } },
        { "type": "cta", "props": { "title": "Have a project in mind?", "subtitle": "Let's create something amazing together.", "button": "Start a Project" } },
        { "type": "footer", "props": {} }
      ]
    },
    "work": {
      "title": "Our Work",
      "sections": [
        { "type": "CategoryNav", "props": {} },
        { "type": "PostList", "props": { "limit": 9 } }
      ]
    },
    "services": {
      "title": "Services",
      "sections": [
        { "type": "features", "props": { "title": "Our Services", "columns": 2 } },
        { "type": "cta", "props": { "title": "Ready to elevate your brand?", "button": "Get a Quote" } }
      ]
    },
    "contact": {
      "title": "Contact",
      "sections": [
        { "type": "contactForm", "props": { "title": "Let's Talk", "fields": ["name", "email", "company", "budget", "message"] } }
      ]
    }
  },
  "mockData": {
    "features": {
      "fields": [
        { "name": "title", "type": "string", "values": ["Web Design", "Development", "Brand Strategy", "UI/UX Design", "SEO & Marketing", "Maintenance"] },
        { "name": "description", "type": "string", "values": ["Beautiful, responsive websites that convert visitors into customers.", "Robust web applications built with modern technologies.", "Strategic branding that tells your story and connects with your audience.", "User-centered design that creates intuitive, delightful experiences.", "Data-driven strategies to grow your online presence.", "Ongoing support and updates to keep your site running smoothly."] },
        { "name": "icon", "type": "string", "values": ["palette", "code", "star", "edit", "chart", "settings"] }
      ],
      "count": 6
    },
    "projects": {
      "fields": [
        { "name": "title", "type": "string", "values": ["TechFlow Rebrand", "GreenLeaf E-commerce", "Meridian Financial", "Artisan Coffee Co", "Urban Fitness App", "CloudSync Dashboard"] },
        { "name": "excerpt", "type": "string", "values": ["Complete brand identity and web presence for a SaaS startup.", "Online store with custom checkout and inventory management.", "Corporate website with interactive data visualizations.", "Brand identity and e-commerce for artisan coffee roasters.", "Mobile-first fitness tracking application.", "Admin dashboard for cloud infrastructure management."] },
        { "name": "category", "type": "string", "values": ["Branding", "E-commerce", "Corporate", "Branding", "App", "Dashboard"] }
      ],
      "count": 6
    },
    "categories": {
      "fields": [
        { "name": "id", "type": "string", "values": ["all", "branding", "e-commerce", "corporate", "app", "dashboard"] },
        { "name": "label", "type": "string", "values": ["All", "Branding", "E-commerce", "Corporate", "App", "Dashboard"] },
        { "name": "count", "type": "number", "values": [6, 2, 1, 1, 1, 1] }
      ],
      "count": 6
    }
  }
}