{
  "id": "blog",
  "name": "Blog",
  "category": "content",
  "description": "Post listings, article pages, categories, and author profiles.",
  "kits": ["content"],
  "layout": {
    "type": "topnav",
    "header": { "show": true, "search": true, "notifications": false, "userMenu": false }
  },
  "routes": [
    { "path": "/", "page": "home", "label": "Home", "icon": "home" },
    { "path": "/blog", "page": "posts", "label": "Blog", "icon": "edit" },
    { "path": "/blog/:slug", "page": "article", "label": "Article" },
    { "path": "/about", "page": "about", "label": "About", "icon": "user" }
  ],
  "pages": {
    "home": {
      "title": "Home",
      "sections": [
        { "type": "PostList", "props": { "title": "Latest Posts", "limit": 6 } },
        { "type": "CategoryNav", "props": {} }
      ]
    },
    "posts": {
      "title": "All Posts",
      "sections": [
        { "type": "CategoryNav", "props": {} },
        { "type": "PostList", "props": { "limit": 12 } }
      ]
    },
    "article": {
      "title": "Article",
      "sections": [
        { "type": "ArticleLayout", "props": { "toc": true } },
        { "type": "AuthorCard", "props": {} }
      ]
    },
    "about": {
      "title": "About",
      "sections": [
        { "type": "AuthorCard", "props": {} }
      ]
    }
  },
  "mockData": {
    "posts": {
      "fields": [
        { "name": "title", "type": "string", "values": ["Getting Started with Signals", "Building a Design System", "CSS Variables Deep Dive", "Zero-Dependency Frameworks", "AI-First Development", "Web Components in 2026"] },
        { "name": "excerpt", "type": "string", "values": ["Learn how signal-based reactivity works under the hood.", "A practical guide to building consistent UI components.", "Master CSS custom properties for theming and beyond.", "Why fewer dependencies means better software.", "How AI is changing the way we write code.", "The state of web components and their future."] },
        { "name": "date", "type": "date", "values": ["2026-02-20", "2026-02-18", "2026-02-15", "2026-02-10", "2026-02-05", "2026-01-28"] },
        { "name": "author", "type": "string", "values": ["Alex Rivera", "Alex Rivera", "Sam Chen", "Alex Rivera", "Sam Chen", "Alex Rivera"] },
        { "name": "category", "type": "string", "values": ["Tutorials", "Design", "CSS", "Architecture", "AI", "Web Standards"] }
      ],
      "count": 6
    },
    "categories": {
      "fields": [
        { "name": "id", "type": "string", "values": ["tutorials", "design", "css", "architecture", "ai", "web-standards"] },
        { "name": "label", "type": "string", "values": ["Tutorials", "Design", "CSS", "Architecture", "AI", "Web Standards"] },
        { "name": "count", "type": "number", "values": [12, 8, 6, 5, 4, 3] }
      ],
      "count": 6
    },
    "author": {
      "fields": [
        { "name": "name", "type": "string", "values": ["Alex Rivera"] },
        { "name": "bio", "type": "string", "values": ["Full-stack developer and tech writer. Building the future of web development, one signal at a time."] },
        { "name": "avatar", "type": "string", "values": [""] }
      ],
      "count": 1
    }
  }
}