{
  "id": "stock-tracker",
  "name": "Stock Tracker",
  "category": "dashboard",
  "description": "Portfolio overview, watchlist, price charts, and trade history.",
  "kits": ["dashboard"],
  "layout": {
    "type": "sidebar",
    "sidebar": { "position": "left", "collapsible": true },
    "header": { "show": true, "search": true, "notifications": true, "userMenu": true }
  },
  "routes": [
    { "path": "/", "page": "portfolio", "label": "Portfolio", "icon": "dollar" },
    { "path": "/watchlist", "page": "watchlist", "label": "Watchlist", "icon": "star" },
    { "path": "/trades", "page": "trades", "label": "Trade History", "icon": "table" },
    { "path": "/settings", "page": "settings", "label": "Settings", "icon": "settings" }
  ],
  "pages": {
    "portfolio": {
      "title": "Portfolio",
      "sections": [
        { "type": "StatsGrid", "props": { "columns": 4, "items": [
          { "title": "Total Value", "value": "$127,450", "change": "+3.2%", "icon": "dollar" },
          { "title": "Day Change", "value": "+$1,245", "change": "+0.98%", "icon": "trending-up" },
          { "title": "Total Gain", "value": "+$18,320", "change": "+16.8%", "icon": "chart" },
          { "title": "Positions", "value": "12", "change": "", "icon": "activity" }
        ]}},
        { "type": "ChartPlaceholder", "props": { "title": "Portfolio Performance" } },
        { "type": "DataTable", "props": { "searchable": false, "columns": [
          { "key": "symbol", "label": "Symbol" },
          { "key": "shares", "label": "Shares" },
          { "key": "price", "label": "Price" },
          { "key": "change", "label": "Change" },
          { "key": "value", "label": "Value" }
        ]}}
      ]
    },
    "watchlist": {
      "title": "Watchlist",
      "sections": [
        { "type": "DataTable", "props": { "searchable": true, "columns": [
          { "key": "symbol", "label": "Symbol" },
          { "key": "price", "label": "Price" },
          { "key": "change", "label": "Change" },
          { "key": "volume", "label": "Volume" },
          { "key": "marketCap", "label": "Market Cap" }
        ]}}
      ]
    },
    "trades": {
      "title": "Trade History",
      "sections": [
        { "type": "DataTable", "props": { "searchable": true, "columns": [
          { "key": "date", "label": "Date" },
          { "key": "symbol", "label": "Symbol" },
          { "key": "type", "label": "Type" },
          { "key": "shares", "label": "Shares" },
          { "key": "price", "label": "Price" },
          { "key": "total", "label": "Total" }
        ]}}
      ]
    },
    "settings": {
      "title": "Settings",
      "sections": []
    }
  },
  "mockData": {
    "portfolio": {
      "fields": [
        { "name": "symbol", "type": "string", "values": ["AAPL", "GOOGL", "MSFT", "TSLA", "AMZN"] },
        { "name": "shares", "type": "number", "values": [50, 20, 35, 15, 25] },
        { "name": "price", "type": "currency", "values": ["$178.50", "$142.30", "$415.20", "$245.80", "$185.60"] },
        { "name": "change", "type": "percent", "values": ["+1.2%", "-0.8%", "+2.1%", "+3.5%", "-0.3%"] },
        { "name": "value", "type": "currency", "values": ["$8,925", "$2,846", "$14,532", "$3,687", "$4,640"] }
      ],
      "count": 5
    },
    "watchlist": {
      "fields": [
        { "name": "symbol", "type": "string", "values": ["NVDA", "META", "NFLX", "AMD", "CRM"] },
        { "name": "price", "type": "currency", "values": ["$875.30", "$525.10", "$635.40", "$165.20", "$295.80"] },
        { "name": "change", "type": "percent", "values": ["+4.2%", "+1.5%", "-2.1%", "+0.8%", "-0.5%"] },
        { "name": "volume", "type": "string", "values": ["45.2M", "28.1M", "12.8M", "62.3M", "8.4M"] },
        { "name": "marketCap", "type": "string", "values": ["$2.15T", "$1.35T", "$275B", "$267B", "$285B"] }
      ],
      "count": 5
    },
    "trades": {
      "fields": [
        { "name": "date", "type": "date", "values": ["2026-02-20", "2026-02-19", "2026-02-18", "2026-02-15", "2026-02-14"] },
        { "name": "symbol", "type": "string", "values": ["AAPL", "TSLA", "MSFT", "GOOGL", "AMZN"] },
        { "name": "type", "type": "string", "values": ["Buy", "Sell", "Buy", "Buy", "Sell"] },
        { "name": "shares", "type": "number", "values": [10, 5, 15, 8, 12] },
        { "name": "price", "type": "currency", "values": ["$176.20", "$248.50", "$412.80", "$140.60", "$187.30"] },
        { "name": "total", "type": "currency", "values": ["$1,762", "$1,242.50", "$6,192", "$1,124.80", "$2,247.60"] }
      ],
      "count": 5
    }
  }
}