{
  "id": "startup",
  "name": "Startup Launch",
  "category": "marketing",
  "description": "Product hero, benefits, social proof, early access signup.",
  "kits": ["content", "auth"],
  "layout": {
    "type": "landing",
    "header": { "show": true, "search": false, "notifications": false, "userMenu": false }
  },
  "routes": [
    { "path": "/", "page": "home", "label": "Home" },
    { "path": "/features", "page": "features", "label": "Features" },
    { "path": "/pricing", "page": "pricing", "label": "Pricing" },
    { "path": "/early-access", "page": "early-access", "label": "Early Access" }
  ],
  "pages": {
    "home": {
      "title": "Home",
      "sections": [
        { "type": "hero", "props": { "title": "The future of [category] is here", "subtitle": "Join the waitlist for early access to the most powerful [category] tool ever built.", "cta": "Get Early Access", "ctaHref": "/early-access" } },
        { "type": "features", "props": { "title": "Why [Product]?", "columns": 3 } },
        { "type": "testimonials", "props": { "title": "What people are saying" } },
        { "type": "cta", "props": { "title": "Be the first to try it", "subtitle": "Limited early access spots available.", "button": "Join Waitlist" } },
        { "type": "footer", "props": {} }
      ]
    },
    "features": {
      "title": "Features",
      "sections": [
        { "type": "features", "props": { "title": "Built for the future", "columns": 2 } }
      ]
    },
    "pricing": {
      "title": "Pricing",
      "sections": [
        { "type": "pricing", "props": { "title": "Launch pricing", "tiers": [
          { "name": "Early Bird", "price": "$9", "period": "/month", "features": ["All core features", "Community support", "5GB storage"], "cta": "Join Waitlist" },
          { "name": "Founder", "price": "$29", "period": "/month", "features": ["Everything in Early Bird", "Priority support", "50GB storage", "API access", "Custom branding"], "cta": "Join Waitlist", "popular": true },
          { "name": "Team", "price": "$79", "period": "/month", "features": ["Everything in Founder", "Unlimited storage", "Team management", "SSO", "Dedicated support"], "cta": "Contact Us" }
        ]}}
      ]
    },
    "early-access": {
      "title": "Early Access",
      "sections": [
        { "type": "hero", "props": { "title": "Get Early Access", "subtitle": "Be among the first to experience [Product]. Enter your email below." } },
        { "type": "signupForm", "props": { "title": "Join the Waitlist", "fields": ["email"] } }
      ]
    }
  },
  "mockData": {
    "features": {
      "fields": [
        { "name": "title", "type": "string", "values": ["AI-Powered", "Real-time Sync", "Beautiful Design", "Blazing Fast", "Open API", "Enterprise Ready"] },
        { "name": "description", "type": "string", "values": ["Smart suggestions powered by the latest AI models.", "Collaborate in real-time with zero lag.", "Stunning interface that's a joy to use every day.", "Optimized for speed at every level of the stack.", "Integrate with anything through our comprehensive API.", "SOC2 compliant with enterprise-grade security."] },
        { "name": "icon", "type": "string", "values": ["bot", "activity", "palette", "bolt", "code", "shield"] }
      ],
      "count": 6
    },
    "testimonials": {
      "fields": [
        { "name": "quote", "type": "string", "values": ["I've been on the beta and it's already better than anything else I've tried.", "The speed is unbelievable. Everything happens instantly.", "Finally, a tool that understands how modern teams actually work."] },
        { "name": "name", "type": "string", "values": ["Taylor Kim", "Jordan Walsh", "Casey Nguyen"] },
        { "name": "role", "type": "string", "values": ["Founder at LaunchPad", "Tech Lead at DevOps Inc", "Product Manager at Scale.io"] }
      ],
      "count": 3
    }
  }
}