{
  "id": "analytics",
  "name": "Analytics Dashboard",
  "category": "dashboard",
  "description": "KPI cards, charts, activity feed, and data tables.",
  "kits": ["dashboard"],
  "layout": {
    "type": "sidebar",
    "sidebar": { "position": "left", "collapsible": true },
    "header": { "show": true, "search": true, "notifications": true, "userMenu": true }
  },
  "routes": [
    { "path": "/", "page": "overview", "label": "Overview", "icon": "home" },
    { "path": "/analytics", "page": "analytics", "label": "Analytics", "icon": "chart" },
    { "path": "/reports", "page": "reports", "label": "Reports", "icon": "table" },
    { "path": "/settings", "page": "settings", "label": "Settings", "icon": "settings" }
  ],
  "pages": {
    "overview": {
      "title": "Overview",
      "sections": [
        { "type": "StatsGrid", "props": { "columns": 4, "items": [
          { "title": "Total Users", "value": "12,847", "change": "+12%", "icon": "users" },
          { "title": "Revenue", "value": "$48,290", "change": "+8%", "icon": "dollar" },
          { "title": "Sessions", "value": "24,531", "change": "+18%", "icon": "activity" },
          { "title": "Bounce Rate", "value": "32.1%", "change": "-4%", "icon": "trending-down" }
        ]}},
        { "type": "ChartPlaceholder", "props": { "title": "Revenue Over Time" } },
        { "type": "ActivityFeed", "props": { "title": "Recent Activity", "count": 5 } }
      ]
    },
    "analytics": {
      "title": "Analytics",
      "sections": [
        { "type": "StatsGrid", "props": { "columns": 3, "items": [
          { "title": "Page Views", "value": "89,420", "change": "+22%", "icon": "activity" },
          { "title": "Unique Visitors", "value": "31,209", "change": "+15%", "icon": "users" },
          { "title": "Avg. Duration", "value": "4m 32s", "change": "+7%", "icon": "trending-up" }
        ]}},
        { "type": "ChartPlaceholder", "props": { "title": "Traffic Sources" } },
        { "type": "ChartPlaceholder", "props": { "title": "User Geography" } }
      ]
    },
    "reports": {
      "title": "Reports",
      "sections": [
        { "type": "DataTable", "props": { "searchable": true, "columns": [
          { "key": "name", "label": "Report Name" },
          { "key": "type", "label": "Type" },
          { "key": "date", "label": "Generated" },
          { "key": "status", "label": "Status" }
        ]}}
      ]
    },
    "settings": {
      "title": "Settings",
      "sections": []
    }
  },
  "mockData": {
    "reports": {
      "fields": [
        { "name": "name", "type": "string", "values": ["Q1 Revenue Report", "User Growth Analysis", "Traffic Breakdown", "Conversion Funnel", "Monthly Summary"] },
        { "name": "type", "type": "string", "values": ["Financial", "Analytics", "Traffic", "Conversion", "Summary"] },
        { "name": "date", "type": "date", "values": ["2026-02-20", "2026-02-18", "2026-02-15", "2026-02-10", "2026-02-01"] },
        { "name": "status", "type": "status", "values": ["Complete", "In Progress", "Complete", "Pending", "Complete"] }
      ],
      "count": 5
    }
  }
}